"Анкетирование ""Опрос по IT-инфраструктуры ППС""";;;;;;;;;;;;;;;;;;;;;;;;;;;;;;;;;;;;;;;;;;;;;;;;;;;;;;
22218304;2025-12-26 18:37;Кафедра Компьютерная и программная инженерия;ст. преподаватель;;;;;Нет;Доктор PhD;—;2;2;Русский язык;Другой (Преподаватель);Информационных технологий;Хорошее;Нет проблем;Отлично;Сенсорное управление;Отличный;все зоны покрыты сетью wi-fi;Редко;Удобны;Корпоративная почта;Хорошая;Редко;Удобно;Добавить свою платформу для проверки работ на плагиат работ учащихся или предоставить бесплатный доступ всем ППС к платной имеющейся платформе антиплагиат-проверки.;Продвинутый: высокий уровень навыков в использовании цифровых инструментов, способность решать сложные задачи.;Microsoft Teams, SmartENU, Platonus, Microsoft Outlook, MS Office Online;Организация учебного процесса: создание и проведение онлайн-уроков, размещение учебных материалов, создание и проверка заданий, Совместная работа и коммуникация: совместное редактирование документов, обмен файлами, обсуждение проектов и задач, проведение онлайн-встреч, Управление учебными исследованиями: поиск и анализ академических ресурсов, управление исследовательских проектов, совместная работа над научными публикациями, Управление временем и задачами: планирование расписания, создание списка дел, отслеживание сроков выполнения задач, Управление обучением и оцениванием: проведение тестирования, отслеживание успеваемости студентов, предоставление обратной связи, Управление административными задачами: ведение учета студентов, подготовка отчетов, оформление документов, взаимодействие с учебным персоналом и администрацией, Участие в профессиональном развитии: доступ к онлайн-курсам, сетевое общение с коллегами, участие в вебинарах и тренингах;Улучшение коммуникации и совместной работы;Затрудняюсь ответить;Доступ к обучающим материалам и руководствам (видеоуроки, инструкции, FAQ) по использованию цифровых инструментов;-;7;Скорее соответствуют;Инструменты легки в использовании, легко осваиваются и комфортны;10;9;10;8;10;10;Ограниченно интегрированы, только с некоторыми системами и сервисами университета;Предоставляют частично;Скорее обеспечивают;8;Улучшить модуль тестирования для проведения аттестации;9.0;9.0;9.0;-;9.0
22218305;2025-12-27 11:52;Кафедра Архитектура;ст. преподаватель;;;;;Нет;Доктор PhD;—;9;2;Русский язык;Другой (Преподаватель);АСФ;Неудовлетворительное;Недостаток установленного ПО;Хорошо;Большой экран;Плохой;АСФ;Да, активно;Очень удобны;Корпоративная почта;Удовлетворительная;Часто;Удобно;-;Продвинутый: высокий уровень навыков в использовании цифровых инструментов, способность решать сложные задачи.;-;Организация учебного процесса: создание и проведение онлайн-уроков, размещение учебных материалов, создание и проверка заданий, Совместная работа и коммуникация: совместное редактирование документов, обмен файлами, обсуждение проектов и задач, проведение онлайн-встреч, Управление учебными исследованиями: поиск и анализ академических ресурсов, управление исследовательских проектов, совместная работа над научными публикациями, Управление временем и задачами: планирование расписания, создание списка дел, отслеживание сроков выполнения задач, Управление обучением и оцениванием: проведение тестирования, отслеживание успеваемости студентов, предоставление обратной связи, Управление административными задачами: ведение учета студентов, подготовка отчетов, оформление документов, взаимодействие с учебным персоналом и администрацией, Участие в профессиональном развитии: доступ к онлайн-курсам, сетевое общение с коллегами, участие в вебинарах и тренингах;Доступ к необходимой информации из любого места и в любое время через онлайн-сервисы и цифровые инструменты (облачные хранилища данных или электронные библиотеки);Постоянные проблемы с подключением к сети интернет или низкая скорость, что затрудняет доступ к цифровым ресурсам и выполнение задач;Доступ к обучающим материалам и руководствам (видеоуроки, инструкции, FAQ) по использованию цифровых инструментов;-;7;Скорее соответствуют;Есть некоторые сложности, с которыми сталкиваешься в работе;8;7;9;9;8;8;Ограниченно интегрированы, только с некоторыми системами и сервисами университета;Предоставляют частично;Скорее обеспечивают;7;-;5.0;6.0;6.0;-;8.0
22218312;2025-12-27 15:09;Кафедра Физической и экономической географии;ст. преподаватель;;;;;Нет;Магистр;—;2;2;Русский язык;Другой (Старший преподаватель);ФЕН;Удовлетворительное;Недостаточная производительность, Медленная загрузка;Хорошо;Мобильность комплекса;Плохой;в аудиториях;Нет;Не использую;Корпоративная почта;Удовлетворительная;Иногда;Затрудняюсь ответить;доступность, работа операционных задач в самих цифровых платформах/инструментах Платонус, Сайт, СмартЕНУ, алгоритмов, поддержка обратной связью при возникновении сложностей или неисправностей;Базовый: основные навыки в работе с цифровыми инструментами, но требуется дополнительное обучение;Платонус, СмартЕНУ;Участие в профессиональном развитии: доступ к онлайн-курсам, сетевое общение с коллегами, участие в вебинарах и тренингах;Возможность выполнять задачи быстрее и эффективнее благодаря автоматизации процессов и доступу к информации в реальном времени;Постоянные проблемы с подключением к сети интернет или низкая скорость, что затрудняет доступ к цифровым ресурсам и выполнение задач;Индивидуальные консультации и помощь специалистов по цифровым инструментам для решения специфических проблем или вопросов;интегированные и работающие, с возможностью обратной связи с указанием причин затрудняющих/препятствующих выполнение задач;8;Затрудняюсь ответить;Есть некоторые сложности, с которыми сталкиваешься в работе;8;7;7;7;9;8;Затрудняюсь ответить;Предоставляют частично;Затрудняюсь ответить;5;доступность работы, особенно в даты выставления текущих оценок при закрытии недели выставления оценок;5.0;7.0;5.0;интегированные и работающие функции, с возможностью обратной связи с указанием причин затрудняющих/препятствующих выполнение задач;8.0
22218332;2025-12-29 11:51;;;Кафедра Психологии;преподаватель;;;Нет;—;—;3;3;Русский язык;Другой (қызметкер);ФЖСН;Неудовлетворительное;Медленная загрузка;Плохо;Большой экран;Хороший;нет проблем;Да, активно;Очень удобны;Корпоративная почта;Хорошая;Иногда;Удобно;-;Продвинутый: высокий уровень навыков в использовании цифровых инструментов, способность решать сложные задачи.;-;Управление временем и задачами: планирование расписания, создание списка дел, отслеживание сроков выполнения задач, Управление обучением и оцениванием: проведение тестирования, отслеживание успеваемости студентов, предоставление обратной связи, Управление административными задачами: ведение учета студентов, подготовка отчетов, оформление документов, взаимодействие с учебным персоналом и администрацией;Возможность использования цифровых инструментов для доступа к научным исследованиям, анализу данных, визуализации результатов;Отсутствие или недостаточная техническая поддержка при возникновении проблем с цифровыми инструментами;Доступ к обучающим материалам и руководствам (видеоуроки, инструкции, FAQ) по использованию цифровых инструментов;-;8;Скорее соответствуют;Инструменты легки в использовании, легко осваиваются и комфортны;6;5;5;6;5;5;Полностью интегрированы с другими системами и сервисами университета;Представляют в полной мере;Обеспечивают в полной мере;9;-;3.0;7.0;5.0;-;5.0
22218375;2025-12-26 10:57;Кафедра Управления и инжиниринга в сфере охраны окружающей среды;профессор;;;;;Нет;Кандидат наук;Профессор;2;2;Русский язык;Другой (преподаватель);ФЕ;Удовлетворительное;Медленная загрузка;Удовлетворительно;Большой экран;Удовлетворительный;аудитории;Иногда;Удобны;Онлайн-документы;Удовлетворительная;Иногда;Удобно;повысить скорость интернета;Средний: уверенное владение основными цифровыми инструментами, способность эффективно выполнять задачи.;все;Организация учебного процесса: создание и проведение онлайн-уроков, размещение учебных материалов, создание и проверка заданий;Доступ к необходимой информации из любого места и в любое время через онлайн-сервисы и цифровые инструменты (облачные хранилища данных или электронные библиотеки);Постоянные проблемы с подключением к сети интернет или низкая скорость, что затрудняет доступ к цифровым ресурсам и выполнение задач;Обучение по вопросам кибербезопасности и защиты данных при работе с цифровыми инструментами;все;7;Затрудняюсь ответить;Есть некоторые сложности, с которыми сталкиваешься в работе;7;7;7;7;7;7;Ограниченно интегрированы, только с некоторыми системами и сервисами университета;Затрудняюсь ответить;Затрудняюсь ответить;7;нет;7.0;7.0;7.0;нет;7.0
22218458;2025-12-29 12:31;Кафедра Геодезия и картография;преподаватель;;;;;Нет;—;—;2;2;Русский язык;Другой (аспирант);архитектурно строительный факультет;Неудовлетворительное;Недостаток установленного ПО;Плохо;Сенсорное управление;Плохой;в отдельных кабинетах;Иногда;Средне;Онлайн-документы;Удовлетворительная;Иногда;Удобно;скорость интернета повысить;Продвинутый: высокий уровень навыков в использовании цифровых инструментов, способность решать сложные задачи.;профессиональные программные продукты;Совместная работа и коммуникация: совместное редактирование документов, обмен файлами, обсуждение проектов и задач, проведение онлайн-встреч;Доступ к необходимой информации из любого места и в любое время через онлайн-сервисы и цифровые инструменты (облачные хранилища данных или электронные библиотеки);Постоянные проблемы с подключением к сети интернет или низкая скорость, что затрудняет доступ к цифровым ресурсам и выполнение задач;Консультации и поддержку в формате онлайн-вебинаров или групповых сессий по вопросам использования цифровых инструментов;нет;5;Скорее соответствуют;Инструменты легки в использовании, легко осваиваются и комфортны;6;5;5;5;6;5;Ограниченно интегрированы, только с некоторыми системами и сервисами университета;Предоставляют частично;Скорее не обеспечивают;5;улучшить интернет;4.0;4.0;4.0;нет;4.0
22218461;2025-12-29 09:10;Кафедра Теоретическая и прикладная лингвистика;ст. преподаватель;;;;;Нет;Кандидат наук;—;2;2;Русский язык;Другой (кандидат наук);Филологический;Хорошее;Нет проблем;Хорошо;Большой экран;Плохой;В административном корпусе;Да, активно;Очень удобны;Онлайн-документы;Отличная;Никогда;Очень удобно;скорость и доступность;Продвинутый: высокий уровень навыков в использовании цифровых инструментов, способность решать сложные задачи.;Все;Организация учебного процесса: создание и проведение онлайн-уроков, размещение учебных материалов, создание и проверка заданий, Совместная работа и коммуникация: совместное редактирование документов, обмен файлами, обсуждение проектов и задач, проведение онлайн-встреч, Управление учебными исследованиями: поиск и анализ академических ресурсов, управление исследовательских проектов, совместная работа над научными публикациями, Управление временем и задачами: планирование расписания, создание списка дел, отслеживание сроков выполнения задач, Участие в профессиональном развитии: доступ к онлайн-курсам, сетевое общение с коллегами, участие в вебинарах и тренингах;Возможность использования цифровых инструментов для доступа к научным исследованиям, анализу данных, визуализации результатов;Проблемы с безопасностью и конфиденциальностью данных при использовании цифровых инструментов, включая угрозы кибератак и утечек информации;Обучение по вопросам кибербезопасности и защиты данных при работе с цифровыми инструментами;LED экраны;10;В полной мере соответствуют;Работать с ними по большей части неудобно, слишком сложно;10;10;10;10;10;10;Полностью интегрированы с другими системами и сервисами университета;Представляют в полной мере;Обеспечивают в полной мере;1;внедрить сдавать экзамены, уже даже частные вузы сдают в Платонусе;10.0;10.0;10.0;скорость;10.0
22218468;2025-12-27 20:20;Кафедра Иностранных языков (Филологический факультет);ассоциированный профессор (доцент);Кафедра Теории и практики иностранных языков;ассоциированный профессор (доцент);;;Нет;Кандидат наук;ассоциированный профессор (доцент);31;31;Русский язык;Другой (преподаватель);филологический;Неудовлетворительное;Медленная загрузка;Удовлетворительно;Сенсорное управление;Плохой;циси, фит, улк;Да, активно;Удобны;Ответ с комментарием (тестовые задания);Удовлетворительная;Часто;Удобно;поставить интерактивные доски во всех аудиториях, где проводятся практические занятия;Продвинутый: высокий уровень навыков в использовании цифровых инструментов, способность решать сложные задачи.;их много очень;Организация учебного процесса: создание и проведение онлайн-уроков, размещение учебных материалов, создание и проверка заданий, Совместная работа и коммуникация: совместное редактирование документов, обмен файлами, обсуждение проектов и задач, проведение онлайн-встреч, Управление обучением и оцениванием: проведение тестирования, отслеживание успеваемости студентов, предоставление обратной связи;Доступ к необходимой информации из любого места и в любое время через онлайн-сервисы и цифровые инструменты (облачные хранилища данных или электронные библиотеки);Постоянные проблемы с подключением к сети интернет или низкая скорость, что затрудняет доступ к цифровым ресурсам и выполнение задач;Создание сообщества пользователей цифровых инструментов, где можно обмениваться опытом и получать советы от коллег;невозможно перечислить;3;Затрудняюсь ответить;Затрудняюсь ответить;4;4;4;4;4;4;Хорошо интегрированы с другими системами и сервисами университета;Предоставляют частично;Затрудняюсь ответить;5;нет;3.0;5.0;5.0;нет;5.0
