"Анкетирование ""Опрос по IT-инфраструктуры ППС""";;;;;;;;;;;;;;;;;;;;;;;;;;;;;;;;;;;;;;;;;;;;;;;;;;;;;;
22217531;2025-12-28 11:52;Кафедра Химии;ассоциированный профессор (доцент);;;;;Нет;Кандидат наук;ассоциированный профессор (доцент);19;8;Русский язык;Другой (Преподаватель);of Natural Sciences;Удовлетворительное;Недостаточная производительность, Недостаток установленного ПО, Медленная загрузка;Удовлетворительно;Ответ с комментарием (все варианты важны);Удовлетворительный;во всем корпусе;Да, активно;Удобны;Ответ с комментарием (все варианты важны);Хорошая;Часто;Удобно;"1) прошу наладить работу сенсорных экранов, их и так мало, так еще и не работают часто.
2) у меня раб компьютер загружается только 40 мин, сотрудники проверяли и сказали, что это еще нормальный (не старый) компьютер. Это сильно отражается на эффективности моей работы.";Продвинутый: высокий уровень навыков в использовании цифровых инструментов, способность решать сложные задачи.;у меня раб компьютер загружается только 40 мин, сотрудники проверяли и сказали, что это еще нормальный (не старый) компьютер. Это сильно отражается на эффективности моей работы. 2 года жду замены (новый), видимо, так и буду ждать еще7;"Организация учебного процесса: создание и проведение онлайн-уроков, размещение учебных материалов, создание и проверка заданий, Совместная работа и коммуникация: совместное редактирование документов, обмен файлами, обсуждение проектов и задач, проведение онлайн-встреч, Управление учебными исследованиями: поиск и анализ академических ресурсов, управление исследовательских проектов, совместная работа над научными публикациями, Управление временем и задачами: планирование расписания, создание списка дел, отслеживание сроков выполнения задач, Управление обучением и оцениванием: проведение тестирования, отслеживание успеваемости студентов, предоставление обратной связи, Управление административными задачами: ведение учета студентов, подготовка отчетов, оформление документов, взаимодействие с учебным персоналом и администрацией, Участие в профессиональном развитии: доступ к онлайн-курсам, сетевое общение с коллегами, участие в вебинарах и тренингах, Ответ с комментарием (все отмеченные пункты, однако, с учетом какой ""старый"" мой рабочий компьютер, это трудно дается. Свой личный лаптоп я носила на работу и во время весенних гололедов прям перед циси упала и разбила его. Теперь не ношу.)";Ответ с комментарием (первые 6 пунктов);Ответ с комментарием (мой рабочий компьютер элементарно еле загружается и сохраняет документы долгоооо);"Ответ с комментарием (1) обеспечить раб компьютером (работающим)
2) wifi: по работе часто участвую в онлайн митингах с коллегами зарубежными, все всремя испытываю проблемы, виснет все. Сходила в библиотеку: там не разрешают сотрудники.
3))";компьютер;3;Затрудняюсь ответить;Работать с ними по большей части неудобно, слишком сложно;5;5;4;3;5;5;Ограниченно интегрированы, только с некоторыми системами и сервисами университета;Затрудняюсь ответить;Скорее не обеспечивают;5;Онлайн приложение на базе app store нужно внедрять активно для преподавателей;3.0;4.0;4.0;Не продумана система, не нравится, что используется ИНН;3.0
22217532;2025-12-26 13:54;Кафедра Стандартизации,  сертификации и метрологии;ассоциированный профессор (доцент);;;;;Нет;Кандидат наук;ассоциированный профессор (доцент);8;8;Русский язык;Другой (асс. профессор);ТЭФ;Удовлетворительное;Медленная загрузка;Удовлетворительно;Большой экран;Удовлетворительный;в местах с физическими препятствиями (стены, мебель, зеркала);Редко;Средне;Корпоративная почта;Удовлетворительная;Редко;Удобно;модернизировать оборудование и ПО, перейти на облачные/гибридные решения для гибкости, усилить кибербезопасность, автоматизировать процессы (включая документооборот), внедрить резервное копирование и мониторинг, а также оптимизировать затраты через виртуализацию и централизацию управления. Основные направления – это повышение эффективности, масштабируемости, безопасности и снижение издержек.;Средний: уверенное владение основными цифровыми инструментами, способность эффективно выполнять задачи.;В университете активно используются платформы для дистанционного обучения (Moodle, Google Classroom, Microsoft Teams), сервисы для видеоконференций (Zoom, Google Meet), инструменты для совместной работы и документов;Управление обучением и оцениванием: проведение тестирования, отслеживание успеваемости студентов, предоставление обратной связи;Улучшение качества обучения и обратной связи;Отсутствие интеграции цифровых инструментов с другими системами и сервисами, что приводит к сложностям;Доступ к обучающим материалам и руководствам (видеоуроки, инструкции, FAQ) по использованию цифровых инструментов;"Интерактивные доски и программное обеспечение ...
Мобильные приложения и платформы ...
Вебинары и видеоконференции ...
Адаптивные образовательные платформы ..";5;Совершенно не соответствуют;Работать с ними очень удобно и просто;5;7;5;7;7;6;Хорошо интегрированы с другими системами и сервисами университета;Не предоставляют совсем;Скорее обеспечивают;5;нет;5.0;5.0;5.0;нет;10.0
22217534;2025-12-26 15:05;Кафедра Теории и практики иностранных языков;ассоциированный профессор (доцент);;;;;Нет;Доктор PhD;ассоциированный профессор (доцент);18;11;Русский язык;Другой (Преподаватель);ВШО;Удовлетворительное;Недостаток установленного ПО;Удовлетворительно;Большой экран;Удовлетворительный;УЛК;Да, активно;Удобны;Корпоративная почта;Удовлетворительная;Иногда;Удобно;Все тис тач обеспечить интернетом, убрать смарт ену для практики либо увеличить скорость и упростить процедуры, невозможно работать в  smart enu, каждый клик крутится по 1-2 минуты, а то и все 20 мин;Средний: уверенное владение основными цифровыми инструментами, способность эффективно выполнять задачи.;Майкрософт тимз, ютуб,;Организация учебного процесса: создание и проведение онлайн-уроков, размещение учебных материалов, создание и проверка заданий, Управление учебными исследованиями: поиск и анализ академических ресурсов, управление исследовательских проектов, совместная работа над научными публикациями, Управление обучением и оцениванием: проведение тестирования, отслеживание успеваемости студентов, предоставление обратной связи, Участие в профессиональном развитии: доступ к онлайн-курсам, сетевое общение с коллегами, участие в вебинарах и тренингах;Возможность использования цифровых инструментов для доступа к научным исследованиям, анализу данных, визуализации результатов;Постоянные проблемы с подключением к сети интернет или низкая скорость, что затрудняет доступ к цифровым ресурсам и выполнение задач;Обучающие курсы и тренинги по использованию конкретных цифровых инструментов, таких как платформы для онлайн-обучения, офисные приложения, научные базы данных и др.;подписка к SPSS,;5;Затрудняюсь ответить;Есть некоторые сложности, с которыми сталкиваешься в работе;7;6;6;7;6;5;Затрудняюсь ответить;Затрудняюсь ответить;Затрудняюсь ответить;5;-;1.0;1.0;1.0;увеличить скорость и усовершенствовать саму систему, невозможно работать в смарт ену, по практике чтобы открыть ответы студента,  нужно очень долго ждать, можно ли автоматизировать систему, и загрузить, к примеру, один договор на всю группу, а не на каждого студента отдельно, на доработку ответы студентов не отправляются, чтобы получить электронную подпись школы, нужно проходить множество преград;5.0
22217557;2025-12-26 23:21;Кафедра Информационной безопасности;Доцент (исполняющий обязанности);;;;;Нет;Доктор PhD;—;7;7;Русский язык;Другой (преподаватель);ИТ;Удовлетворительное;Недостаточная производительность;Хорошо;Большой экран;Плохой;7,6-этажах. В основном по всему корпусу;Нет;Неудобны;Онлайн-документы;Плохая;Часто;Очень удобно;Все аудитории ФИТ должны быть компьютерные классы, в лекционных залах плохо видно, кто сидят в последних рядах. Нет никакого лабораторного класса, все очень старые;Экспертный: глубокое понимание и мастерство в использовании цифровых инструментов, способность к инновациям и разработке новых методов.;нет;Затрудняюсь ответить;Возможность выполнять задачи быстрее и эффективнее благодаря автоматизации процессов и доступу к информации в реальном времени;Постоянные проблемы с подключением к сети интернет или низкая скорость, что затрудняет доступ к цифровым ресурсам и выполнение задач;Обучающие курсы и тренинги по использованию конкретных цифровых инструментов, таких как платформы для онлайн-обучения, офисные приложения, научные базы данных и др.;дополнительные функции Платонуса, для нагрузки ППС (ни в одном вузе коме нас эту работу не делает в бумажн. как мы) , все отчеты, например данные преподавателей базов образоания, и уч.степень есть или нет (эту информацию собирали месяц) и т.д;1;Скорее не соответствуют;Работать с ними по большей части неудобно, слишком сложно;2;2;1;1;1;1;Ограниченно интегрированы, только с некоторыми системами и сервисами университета;Не предоставляют совсем;Совсем не обеспечивают;1;В Платонусе не работают многие функции и еще оно часто не работают, иногда оценки изчезают и т.д;1.0;1.0;1.0;Педагогическую практику магистрантов с отчетами и план графиков ввели 3 месяца, из за неправильности систем. и это неправильно подписать в смарт ЕНУ через ЭЦП;8.0
22217562;2025-12-29 10:14;Кафедра Электроэнергетики;ассоциированный профессор (доцент);;;;;Нет;Кандидат наук;Доцент;37;7;Русский язык;Другой (доцент);Транспортно-энергетический;Удовлетворительное;Недостаток установленного ПО, Медленная загрузка;Отлично;Большой экран;Плохой;на первом этаже корпуса ЦИСИ;Да, активно;Удобны;Корпоративная почта;Плохая;Часто;Удобно;увеличить скорость, устранить зоны плохой связи;Базовый: основные навыки в работе с цифровыми инструментами, но требуется дополнительное обучение;платонус, смарт, корпоративную почту, тимс;Организация учебного процесса: создание и проведение онлайн-уроков, размещение учебных материалов, создание и проверка заданий, Совместная работа и коммуникация: совместное редактирование документов, обмен файлами, обсуждение проектов и задач, проведение онлайн-встреч, Управление учебными исследованиями: поиск и анализ академических ресурсов, управление исследовательских проектов, совместная работа над научными публикациями, Управление временем и задачами: планирование расписания, создание списка дел, отслеживание сроков выполнения задач, Управление обучением и оцениванием: проведение тестирования, отслеживание успеваемости студентов, предоставление обратной связи, Участие в профессиональном развитии: доступ к онлайн-курсам, сетевое общение с коллегами, участие в вебинарах и тренингах;Увеличение гибкости и мобильности, возможность работать удаленно или в пути;Постоянные проблемы с подключением к сети интернет или низкая скорость, что затрудняет доступ к цифровым ресурсам и выполнение задач;Затрудняюсь ответить;рабочий компьютер обновить, на кафедре не у всех имеются рабочие компьютеры;3;Скорее соответствуют;Есть некоторые сложности, с которыми сталкиваешься в работе;7;5;8;8;4;7;Ограниченно интегрированы, только с некоторыми системами и сервисами университета;Затрудняюсь ответить;Затрудняюсь ответить;5;"необходимо убрать оценивание лекционных занятий, там надо ставить ""явка"" либо ""неявка"", пересмотреть оценивание в целом оценивание знаний студента";5.0;4.0;5.0;затрудняюсь ответить;2.0
22217565;2025-12-26 15:22;Кафедра Теоретическая и прикладная лингвистика;Доцент (исполняющий обязанности);;;;;Нет;Кандидат наук;—;33;7;Русский язык;Другой (и.о. доцента кафедры);филологический;Неудовлетворительное;Недостаточная производительность, Медленная загрузка;Удовлетворительно;Большой экран;Удовлетворительный;иногда;Да, активно;Средне;Онлайн-документы;Плохая;Иногда;Удобно;ноутбуки должны ьыть у студентов, а не телефоны;Продвинутый: высокий уровень навыков в использовании цифровых инструментов, способность решать сложные задачи.;Microsoft Teams;Организация учебного процесса: создание и проведение онлайн-уроков, размещение учебных материалов, создание и проверка заданий, Совместная работа и коммуникация: совместное редактирование документов, обмен файлами, обсуждение проектов и задач, проведение онлайн-встреч, Управление обучением и оцениванием: проведение тестирования, отслеживание успеваемости студентов, предоставление обратной связи;Увеличение гибкости и мобильности, возможность работать удаленно или в пути;Отсутствие интеграции цифровых инструментов с другими системами и сервисами, что приводит к сложностям;Создание сообщества пользователей цифровых инструментов, где можно обмениваться опытом и получать советы от коллег;нет;7;Скорее соответствуют;Есть некоторые сложности, с которыми сталкиваешься в работе;7;7;7;3;9;5;Практически не интегрированы с другими системами и сервисами университета;Представляют в полной мере;Скорее обеспечивают;3;нет;2.0;4.0;2.0;нет;3.0
